{
  "$schema": "http://json-schema.org/draft-07/schema#",
  "$id": "agent_run_request.schema.json",
  "type": "object",
  "required": ["run_id", "trade_date", "watchlist", "account_snapshot"],
  "properties": {
    "run_id": { "type": "string", "format": "uuid" },
    "trade_date": { "type": "string", "pattern": "^[0-9]{4}-[0-9]{2}-[0-9]{2}$" },
    "watchlist": {
      "type": "array",
      "minItems": 1,
      "items": { "type": "string", "minLength": 1 }
    },
    "account_snapshot": {
      "type": "object",
      "required": ["cash", "currency", "positions"],
      "properties": {
        "cash": { "type": "number" },
        "currency": { "type": "string", "const": "USD" },
        "positions": {
          "type": "array",
          "items": {
            "type": "object",
            "required": ["symbol", "qty", "avg_cost"],
            "properties": {
              "symbol": { "type": "string" },
              "qty": { "type": "number" },
              "avg_cost": { "type": "number" },
              "stop_loss": { "type": ["number", "null"] },
              "take_profit": { "type": ["number", "null"] }
            }
          }
        }
      }
    },
    "prior_step_outputs": { "type": "object" }
  },
  "additionalProperties": false
}
